Scene,Title,Duration (seconds),Description,Sound/Music,Notes
1,Frozen Morning,8,City completely still; birds midair; time frozen,Soft ticking,Blue light tone
2,The Discovery,10,Eren walks among frozen people,Low hum + footsteps,Add light particle effects
3,The Realization,7,Flashback montage; he realizes power,Heartbeat tick sync,Use flash transitions
4,The Price,8,Empty classroom; missing friend,Soft piano,Desaturated colors
5,Ending / Cliffhanger,10,City resumes, tears frozen midair,Ticking turns to silence,Camera zoom out
